{
		"$schema": "http://json-schema.org/draft-07/schema#",
		"title": "ExecutionPlan",
		"type": "object",
		"additionalProperties": false,
		"required": [
			"description_for_user",
			"five_w_one_h",
			"procedure",
			"surface_effects",
			"constraints",
			"execution_mode"
		],
		"properties": {
			"description_for_user": {
				"type": "string",
				"description": "Short, human-readable description of what will be executed. Written for user confirmation, not implementation."
			},
			"five_w_one_h": {
				"type": "object",
				"additionalProperties": false,
				"required": [
					"who",
					"what",
					"where",
					"when",
					"why",
					"how"
				],
				"properties": {
					"who": {
						"type": "string",
						"description": "Who or what executes the plan (e.g. user, tool, system)."
					},
					"what": {
						"type": "string",
						"description": "Concrete operation being performed (not a goal)."
					},
					"where": {
						"type": "string",
						"description": "Execution surface: filesystem path, service, account, environment."
					},
					"when": {
						"type": "string",
						"description": "When execution happens (e.g. immediate, scheduled, conditional)."
					},
					"why": {
						"type": "string",
						"description": "User-facing reason for this execution."
					},
					"how": {
						"type": "string",
						"description": "High-level method description without commands or flags."
					}
				}
			},
			"procedure": {
				"type": "array",
				"minItems": 1,
				"items": {
					"type": "object",
					"additionalProperties": false,
					"required": [
						"step",
						"action"
					],
					"properties": {
						"step": {
							"type": "integer",
							"minimum": 1,
							"description": "Sequential step number. Order matters."
						},
						"action": {
							"type": "string",
							"description": "Atomic, declarative action with no branching or conditionals."
						}
					}
				},
				"description": "Ordered list of execution steps. No branching, retries, or conditionals."
			},
			"surface_effects": {
				"type": "object",
				"additionalProperties": false,
				"required": [
					"touches",
					"modifies",
					"creates",
					"deletes"
				],
				"properties": {
					"touches": {
						"type": "array",
						"items": {
							"type": "string"
						},
						"description": "Resources or surfaces that will be accessed."
					},
					"modifies": {
						"type": "boolean",
						"description": "Whether existing resources are modified."
					},
					"creates": {
						"type": "boolean",
						"description": "Whether new resources are created."
					},
					"deletes": {
						"type": "boolean",
						"description": "Whether resources are deleted."
					}
				}
			},
			"constraints": {
				"type": "array",
				"items": {
					"type": "string",
					"description": "Hard negative constraint that must not be violated."
				},
				"description": "Hard execution limits. No soft preferences or guidance."
			},
			"execution_mode": {
				"type": "string",
				"enum": [
					"preview",
					"execute"
				],
				"description": "Whether this plan is only previewed or actually executed."
			}
		}
	}